{
  "summary": "The class needs support with foundational topics.",
  "weakTopics": [
    {
      "topicId": "topic_1",
      "reason": "The backend marked this topic as weak."
    }
  ],
  "progressIssues": [
    {
      "studentId": "student_1",
      "description": "Progress is below the expected level."
    }
  ],
  "attentionGroups": [
    {
      "title": "Foundational review",
      "studentIds": [
        "student_1"
      ],
      "description": "Students with attention signals."
    }
  ],
  "recommendations": [
    {
      "title": "Review foundational topics",
      "description": "Organize a short practice session."
    }
  ]
}
